{
  "receipt_version": "2.1",
  "artifact_type": "sofaudit_validation_receipt",
  "receipt_kind": "SOFAUDIT_VALIDATION_RECEIPT",
  "receipt_scope": "SOFAUDIT_PROTOCOL_CONFORMANCE_ONLY",
  "receipt_id": "receipt.traffic_f1.sofaudit-v2_1",
  "audit": {
    "audit_id": "traffic_f1",
    "sofaudit_version": "2.1",
    "artifact": {
      "uri": "experiments/paper13/results/v2.1/audits/traffic_f1.sofaudit.json",
      "digest": {
        "algorithm": "sha256",
        "value": "790de90dd84270fe37566fe533c46243020b0480c8df3f01f79f0c25b9213003"
      }
    }
  },
  "validator": {
    "validator_id": "sofaudit.semantic-validator.v2_1",
    "validator_version": "2.1",
    "implementation": {
      "uri": "experiments/paper13/validation/validate_sofaudit_v2_1.py",
      "digest": {
        "algorithm": "sha256",
        "value": "a69cdcbb4fb7e29152ee1fd7200c8514d747290e5e118a9b81cb0fa8b4e98594"
      }
    },
    "audit_contract": {
      "uri": "schemas/sofaudit/v2.1.schema.json",
      "digest": {
        "algorithm": "sha256",
        "value": "c7d307bbd9f1e69e026deb7fe3f1eeeca25f745d652399bf8c4c374ba10935fe"
      }
    },
    "receipt_contract": {
      "uri": "schemas/sofaudit/validation-receipt-v2.1.schema.json",
      "digest": {
        "algorithm": "sha256",
        "value": "cdb8a32277a2e5d4f5eb30a9f72ce6450642e661d502ce141954dfed4e3b4ad6"
      }
    }
  },
  "generation": {
    "kind": "migration",
    "class": "boundary_annotation",
    "source_version": "2.0",
    "source_artifact": {
      "uri": "experiments/paper13/results/audits/traffic_f1.sofaudit.json",
      "digest": {
        "algorithm": "sha256",
        "value": "1472f624d9414c1438d42df0d2ca60b36a425d39d1e9a1fd7b6875d2b66be0a3"
      }
    },
    "implementation": {
      "uri": "experiments/paper13/validation/migrate_sofaudit_v2_to_v2_1.py",
      "digest": {
        "algorithm": "sha256",
        "value": "75592bcff8503993a261e1b71705f1be03d516411448a6981c0bf061cd42fc82"
      }
    }
  },
  "artifact_closure": {
    "artifact_count": 13,
    "ordered_artifacts": [
      {
        "role": "audit",
        "artifact": {
          "uri": "experiments/paper13/results/v2.1/audits/traffic_f1.sofaudit.json",
          "digest": {
            "algorithm": "sha256",
            "value": "790de90dd84270fe37566fe533c46243020b0480c8df3f01f79f0c25b9213003"
          }
        }
      },
      {
        "role": "revision-source-audit-v2.0",
        "artifact": {
          "uri": "experiments/paper13/results/audits/traffic_f1.sofaudit.json",
          "digest": {
            "algorithm": "sha256",
            "value": "1472f624d9414c1438d42df0d2ca60b36a425d39d1e9a1fd7b6875d2b66be0a3"
          }
        }
      },
      {
        "role": "migration-implementation",
        "artifact": {
          "uri": "experiments/paper13/validation/migrate_sofaudit_v2_to_v2_1.py",
          "digest": {
            "algorithm": "sha256",
            "value": "75592bcff8503993a261e1b71705f1be03d516411448a6981c0bf061cd42fc82"
          }
        }
      },
      {
        "role": "audit-contract",
        "artifact": {
          "uri": "schemas/sofaudit/v2.1.schema.json",
          "digest": {
            "algorithm": "sha256",
            "value": "c7d307bbd9f1e69e026deb7fe3f1eeeca25f745d652399bf8c4c374ba10935fe"
          }
        }
      },
      {
        "role": "source-audit",
        "artifact": {
          "uri": "experiments/paper13/archive/results/traffic_f1.sofaudit",
          "digest": {
            "algorithm": "sha256",
            "value": "9f4f421b875acf7404156332db6d1e87de6e29bdf5d0c30880714fc302b85acf"
          }
        }
      },
      {
        "role": "reference-report",
        "artifact": {
          "uri": "experiments/paper13/results/v2.1/source-reports/reports/traffic_ref.sofreport.json",
          "digest": {
            "algorithm": "sha256",
            "value": "18730d91fb7ef09b063867ef3c1cc4f8ebd97319c6ed30815b054b3e4cc88bbe"
          }
        }
      },
      {
        "role": "target-report",
        "artifact": {
          "uri": "experiments/paper13/results/v2.1/source-reports/reports/traffic_f1_learned.sofreport.json",
          "digest": {
            "algorithm": "sha256",
            "value": "31cbc64393544b071fe713330b61d6085a5dae4c699941a1c77c25c00b4d89b2"
          }
        }
      },
      {
        "role": "reference-report-validation-receipt",
        "artifact": {
          "uri": "experiments/paper13/results/v2.1/source-reports/receipts/traffic_ref.validation-receipt.json",
          "digest": {
            "algorithm": "sha256",
            "value": "ca982e9f519d256db4b5ad79b2d8e42b490f6732d928bc4c15826588b88160b1"
          }
        }
      },
      {
        "role": "target-report-validation-receipt",
        "artifact": {
          "uri": "experiments/paper13/results/v2.1/source-reports/receipts/traffic_f1_learned.validation-receipt.json",
          "digest": {
            "algorithm": "sha256",
            "value": "081d608dd199da83e2fca65e83d8f2f35bf085fd5d91251f00132f090d265725"
          }
        }
      },
      {
        "role": "audit-profile",
        "artifact": {
          "uri": "schemas/sofaudit/paper13-standard-regime-a-profile-v2.0.json",
          "digest": {
            "algorithm": "sha256",
            "value": "25a59d8f5897620deaa69a660b3160d32df43030b097830a0668c9eb8a5a20ee"
          }
        }
      },
      {
        "role": "coordinate-semantics-registry",
        "artifact": {
          "uri": "schemas/sofaudit/coordinate-semantics-registry-v1.0.json",
          "digest": {
            "algorithm": "sha256",
            "value": "1d2dc24ae56cfb364b02bccf8c0c3068138e6d07682cf4b0561ec75f765c6d48"
          }
        }
      },
      {
        "role": "validator-implementation",
        "artifact": {
          "uri": "experiments/paper13/validation/validate_sofaudit_v2_1.py",
          "digest": {
            "algorithm": "sha256",
            "value": "a69cdcbb4fb7e29152ee1fd7200c8514d747290e5e118a9b81cb0fa8b4e98594"
          }
        }
      },
      {
        "role": "validation-receipt-contract",
        "artifact": {
          "uri": "schemas/sofaudit/validation-receipt-v2.1.schema.json",
          "digest": {
            "algorithm": "sha256",
            "value": "cdb8a32277a2e5d4f5eb30a9f72ce6450642e661d502ce141954dfed4e3b4ad6"
          }
        }
      }
    ],
    "closure_digest": {
      "algorithm": "sha256",
      "value": "687fe2e817f44e7b47837874179a5542c409459f39a072e656653d84e99b29d2"
    }
  },
  "status": "PASS",
  "checks": [
    {
      "check_id": "aligned-difference-without-attribution",
      "status": "PASS"
    },
    {
      "check_id": "artifact-digest-closure",
      "status": "PASS"
    },
    {
      "check_id": "explicit-v2.0-to-v2.1-migration",
      "status": "PASS"
    },
    {
      "check_id": "forbidden-semantic-role-scan",
      "status": "PASS"
    },
    {
      "check_id": "reference-role-boundary",
      "status": "PASS"
    },
    {
      "check_id": "schema-validation",
      "status": "PASS"
    },
    {
      "check_id": "source-report-receipt-validation",
      "status": "PASS"
    },
    {
      "check_id": "v2.0-source-validation",
      "status": "PASS"
    }
  ],
  "attribution_boundary": {
    "causal_status": "OUT_OF_SCOPE_FOR_SOFAUDIT",
    "defect_attribution_status": "OUT_OF_SCOPE_FOR_SOFAUDIT",
    "reference_causal_role": "NOT_A_CAUSAL_BASELINE"
  },
  "negative_boundaries": [
    "This receipt establishes aligned-comparison protocol conformance only; localization is not defect or causal attribution, and the reference is not a causal baseline."
  ]
}
