{
  "receipt_version": "2.1",
  "artifact_type": "sofaudit_validation_receipt",
  "receipt_kind": "SOFAUDIT_VALIDATION_RECEIPT",
  "receipt_scope": "SOFAUDIT_PROTOCOL_CONFORMANCE_ONLY",
  "receipt_id": "receipt.gridworld_f2.sofaudit-v2_1",
  "audit": {
    "audit_id": "gridworld_f2",
    "sofaudit_version": "2.1",
    "artifact": {
      "uri": "experiments/paper13/results/v2.1/audits/gridworld_f2.sofaudit.json",
      "digest": {
        "algorithm": "sha256",
        "value": "297d086a41b22e12414c2e6957e8942b6ad8e7d0ef640070df4c1d534be4a51c"
      }
    }
  },
  "validator": {
    "validator_id": "sofaudit.semantic-validator.v2_1",
    "validator_version": "2.1",
    "implementation": {
      "uri": "experiments/paper13/validation/validate_sofaudit_v2_1.py",
      "digest": {
        "algorithm": "sha256",
        "value": "a69cdcbb4fb7e29152ee1fd7200c8514d747290e5e118a9b81cb0fa8b4e98594"
      }
    },
    "audit_contract": {
      "uri": "schemas/sofaudit/v2.1.schema.json",
      "digest": {
        "algorithm": "sha256",
        "value": "c7d307bbd9f1e69e026deb7fe3f1eeeca25f745d652399bf8c4c374ba10935fe"
      }
    },
    "receipt_contract": {
      "uri": "schemas/sofaudit/validation-receipt-v2.1.schema.json",
      "digest": {
        "algorithm": "sha256",
        "value": "7d89e689eea44255e09937cb0746771c69a9592a8245dd6867c9093eb7104d57"
      }
    }
  },
  "generation": {
    "kind": "migration",
    "class": "boundary_annotation",
    "source_version": "2.0",
    "source_artifact": {
      "uri": "experiments/paper13/results/audits/gridworld_f2.sofaudit.json",
      "digest": {
        "algorithm": "sha256",
        "value": "7d48c8bea6683cf2c7602b62a660062ddba2f2c81fb0aa4b0a1b04a7eb4416db"
      }
    },
    "implementation": {
      "uri": "experiments/paper13/validation/migrate_sofaudit_v2_to_v2_1.py",
      "digest": {
        "algorithm": "sha256",
        "value": "75592bcff8503993a261e1b71705f1be03d516411448a6981c0bf061cd42fc82"
      }
    }
  },
  "artifact_closure": {
    "artifact_count": 13,
    "ordered_artifacts": [
      {
        "role": "audit",
        "artifact": {
          "uri": "experiments/paper13/results/v2.1/audits/gridworld_f2.sofaudit.json",
          "digest": {
            "algorithm": "sha256",
            "value": "297d086a41b22e12414c2e6957e8942b6ad8e7d0ef640070df4c1d534be4a51c"
          }
        }
      },
      {
        "role": "revision-source-audit-v2.0",
        "artifact": {
          "uri": "experiments/paper13/results/audits/gridworld_f2.sofaudit.json",
          "digest": {
            "algorithm": "sha256",
            "value": "7d48c8bea6683cf2c7602b62a660062ddba2f2c81fb0aa4b0a1b04a7eb4416db"
          }
        }
      },
      {
        "role": "migration-implementation",
        "artifact": {
          "uri": "experiments/paper13/validation/migrate_sofaudit_v2_to_v2_1.py",
          "digest": {
            "algorithm": "sha256",
            "value": "75592bcff8503993a261e1b71705f1be03d516411448a6981c0bf061cd42fc82"
          }
        }
      },
      {
        "role": "audit-contract",
        "artifact": {
          "uri": "schemas/sofaudit/v2.1.schema.json",
          "digest": {
            "algorithm": "sha256",
            "value": "c7d307bbd9f1e69e026deb7fe3f1eeeca25f745d652399bf8c4c374ba10935fe"
          }
        }
      },
      {
        "role": "source-audit",
        "artifact": {
          "uri": "experiments/paper13/archive/results/gridworld_f2.sofaudit",
          "digest": {
            "algorithm": "sha256",
            "value": "7759af21c03734e7125d919073318c67bc9da30c41771632dd18c9a881297d52"
          }
        }
      },
      {
        "role": "reference-report",
        "artifact": {
          "uri": "experiments/paper13/results/v2.1/source-reports/reports/gridworld_ref.sofreport.json",
          "digest": {
            "algorithm": "sha256",
            "value": "25252e78e92008fae6dc2fa29b7ba42b4c6f5028d93cdd64bb288e8c46d972e8"
          }
        }
      },
      {
        "role": "target-report",
        "artifact": {
          "uri": "experiments/paper13/results/v2.1/source-reports/reports/gridworld_f2_learned.sofreport.json",
          "digest": {
            "algorithm": "sha256",
            "value": "8fe49acd9930cbd1bc8da64c299ab6ea5d5ea659ab7677bd4993e9f9e230f19b"
          }
        }
      },
      {
        "role": "reference-report-validation-receipt",
        "artifact": {
          "uri": "experiments/paper13/results/v2.1/source-reports/receipts/gridworld_ref.validation-receipt.json",
          "digest": {
            "algorithm": "sha256",
            "value": "b40b518b1e9df89895d012c45d1cd72fbe678089eed346895319769af03f2170"
          }
        }
      },
      {
        "role": "target-report-validation-receipt",
        "artifact": {
          "uri": "experiments/paper13/results/v2.1/source-reports/receipts/gridworld_f2_learned.validation-receipt.json",
          "digest": {
            "algorithm": "sha256",
            "value": "b9c5f1eeaf48deaed6769e7e9848d1aeedb0609f299db1d50525de1cfbe2ed91"
          }
        }
      },
      {
        "role": "audit-profile",
        "artifact": {
          "uri": "schemas/sofaudit/paper13-standard-regime-a-profile-v2.0.json",
          "digest": {
            "algorithm": "sha256",
            "value": "25a59d8f5897620deaa69a660b3160d32df43030b097830a0668c9eb8a5a20ee"
          }
        }
      },
      {
        "role": "coordinate-semantics-registry",
        "artifact": {
          "uri": "schemas/sofaudit/coordinate-semantics-registry-v1.0.json",
          "digest": {
            "algorithm": "sha256",
            "value": "1d2dc24ae56cfb364b02bccf8c0c3068138e6d07682cf4b0561ec75f765c6d48"
          }
        }
      },
      {
        "role": "validator-implementation",
        "artifact": {
          "uri": "experiments/paper13/validation/validate_sofaudit_v2_1.py",
          "digest": {
            "algorithm": "sha256",
            "value": "a69cdcbb4fb7e29152ee1fd7200c8514d747290e5e118a9b81cb0fa8b4e98594"
          }
        }
      },
      {
        "role": "validation-receipt-contract",
        "artifact": {
          "uri": "schemas/sofaudit/validation-receipt-v2.1.schema.json",
          "digest": {
            "algorithm": "sha256",
            "value": "7d89e689eea44255e09937cb0746771c69a9592a8245dd6867c9093eb7104d57"
          }
        }
      }
    ],
    "closure_digest": {
      "algorithm": "sha256",
      "value": "4cf18f0d2d9726956eaf1c9e183e850bd1b95f2a1e7920a9b2e119f929d5104c"
    }
  },
  "status": "PASS",
  "checks": [
    {
      "check_id": "aligned-difference-without-attribution",
      "status": "PASS"
    },
    {
      "check_id": "artifact-digest-closure",
      "status": "PASS"
    },
    {
      "check_id": "explicit-v2.0-to-v2.1-migration",
      "status": "PASS"
    },
    {
      "check_id": "forbidden-semantic-role-scan",
      "status": "PASS"
    },
    {
      "check_id": "reference-role-boundary",
      "status": "PASS"
    },
    {
      "check_id": "schema-validation",
      "status": "PASS"
    },
    {
      "check_id": "source-report-receipt-validation",
      "status": "PASS"
    },
    {
      "check_id": "v2.0-source-validation",
      "status": "PASS"
    }
  ],
  "attribution_boundary": {
    "causal_status": "OUT_OF_SCOPE_FOR_SOFAUDIT",
    "defect_attribution_status": "OUT_OF_SCOPE_FOR_SOFAUDIT",
    "reference_causal_role": "NOT_A_CAUSAL_BASELINE"
  },
  "negative_boundaries": [
    "This receipt establishes aligned-comparison protocol conformance only; localization is not defect or causal attribution, and the reference is not a causal baseline."
  ]
}
