{
  "receipt_version": "2.1",
  "artifact_type": "sofaudit_validation_receipt",
  "receipt_kind": "SOFAUDIT_VALIDATION_RECEIPT",
  "receipt_scope": "SOFAUDIT_PROTOCOL_CONFORMANCE_ONLY",
  "receipt_id": "receipt.sir_f3.sofaudit-v2_1",
  "audit": {
    "audit_id": "sir_f3",
    "sofaudit_version": "2.1",
    "artifact": {
      "uri": "experiments/paper13/results/v2.1/audits/sir_f3.sofaudit.json",
      "digest": {
        "algorithm": "sha256",
        "value": "54b43306e3bd1806169f1ebb91708b9f02a3fda9f7a117829e8241e18f3059cf"
      }
    }
  },
  "validator": {
    "validator_id": "sofaudit.semantic-validator.v2_1",
    "validator_version": "2.1",
    "implementation": {
      "uri": "experiments/paper13/validation/validate_sofaudit_v2_1.py",
      "digest": {
        "algorithm": "sha256",
        "value": "a69cdcbb4fb7e29152ee1fd7200c8514d747290e5e118a9b81cb0fa8b4e98594"
      }
    },
    "audit_contract": {
      "uri": "schemas/sofaudit/v2.1.schema.json",
      "digest": {
        "algorithm": "sha256",
        "value": "c7d307bbd9f1e69e026deb7fe3f1eeeca25f745d652399bf8c4c374ba10935fe"
      }
    },
    "receipt_contract": {
      "uri": "schemas/sofaudit/validation-receipt-v2.1.schema.json",
      "digest": {
        "algorithm": "sha256",
        "value": "cdb8a32277a2e5d4f5eb30a9f72ce6450642e661d502ce141954dfed4e3b4ad6"
      }
    }
  },
  "generation": {
    "kind": "migration",
    "class": "boundary_annotation",
    "source_version": "2.0",
    "source_artifact": {
      "uri": "experiments/paper13/results/audits/sir_f3.sofaudit.json",
      "digest": {
        "algorithm": "sha256",
        "value": "087900c245576b66e03e9bc69ef7d43d4144142c724a854b5c15ca8fa038edf4"
      }
    },
    "implementation": {
      "uri": "experiments/paper13/validation/migrate_sofaudit_v2_to_v2_1.py",
      "digest": {
        "algorithm": "sha256",
        "value": "75592bcff8503993a261e1b71705f1be03d516411448a6981c0bf061cd42fc82"
      }
    }
  },
  "artifact_closure": {
    "artifact_count": 13,
    "ordered_artifacts": [
      {
        "role": "audit",
        "artifact": {
          "uri": "experiments/paper13/results/v2.1/audits/sir_f3.sofaudit.json",
          "digest": {
            "algorithm": "sha256",
            "value": "54b43306e3bd1806169f1ebb91708b9f02a3fda9f7a117829e8241e18f3059cf"
          }
        }
      },
      {
        "role": "revision-source-audit-v2.0",
        "artifact": {
          "uri": "experiments/paper13/results/audits/sir_f3.sofaudit.json",
          "digest": {
            "algorithm": "sha256",
            "value": "087900c245576b66e03e9bc69ef7d43d4144142c724a854b5c15ca8fa038edf4"
          }
        }
      },
      {
        "role": "migration-implementation",
        "artifact": {
          "uri": "experiments/paper13/validation/migrate_sofaudit_v2_to_v2_1.py",
          "digest": {
            "algorithm": "sha256",
            "value": "75592bcff8503993a261e1b71705f1be03d516411448a6981c0bf061cd42fc82"
          }
        }
      },
      {
        "role": "audit-contract",
        "artifact": {
          "uri": "schemas/sofaudit/v2.1.schema.json",
          "digest": {
            "algorithm": "sha256",
            "value": "c7d307bbd9f1e69e026deb7fe3f1eeeca25f745d652399bf8c4c374ba10935fe"
          }
        }
      },
      {
        "role": "source-audit",
        "artifact": {
          "uri": "experiments/paper13/archive/results/sir_f3.sofaudit",
          "digest": {
            "algorithm": "sha256",
            "value": "522fcd4efe161b07d095c0eb8d9452a3a1d05d564f691a82ebfe5da7cfaafe34"
          }
        }
      },
      {
        "role": "reference-report",
        "artifact": {
          "uri": "experiments/paper13/results/v2.1/source-reports/reports/sir_ref.sofreport.json",
          "digest": {
            "algorithm": "sha256",
            "value": "c0fa71da5c3457dde6a07ff9f6a817ad6d0a1b4c46badfb3ab0d1214109f7d9a"
          }
        }
      },
      {
        "role": "target-report",
        "artifact": {
          "uri": "experiments/paper13/results/v2.1/source-reports/reports/sir_f3_learned.sofreport.json",
          "digest": {
            "algorithm": "sha256",
            "value": "cd7c2cd3f50a2e982b8585496f8c23a60d81626b9bcc51553d1a8147592efd0b"
          }
        }
      },
      {
        "role": "reference-report-validation-receipt",
        "artifact": {
          "uri": "experiments/paper13/results/v2.1/source-reports/receipts/sir_ref.validation-receipt.json",
          "digest": {
            "algorithm": "sha256",
            "value": "cf44c5a3409d14c1a2cadc2ca0490602ec8a20af30ed4558aab70296ac3a60cb"
          }
        }
      },
      {
        "role": "target-report-validation-receipt",
        "artifact": {
          "uri": "experiments/paper13/results/v2.1/source-reports/receipts/sir_f3_learned.validation-receipt.json",
          "digest": {
            "algorithm": "sha256",
            "value": "4b2ee1988d8fe23b760f111e1d514fad7190727354fdd463ed13e68c170ded8f"
          }
        }
      },
      {
        "role": "audit-profile",
        "artifact": {
          "uri": "schemas/sofaudit/paper13-standard-regime-a-profile-v2.0.json",
          "digest": {
            "algorithm": "sha256",
            "value": "25a59d8f5897620deaa69a660b3160d32df43030b097830a0668c9eb8a5a20ee"
          }
        }
      },
      {
        "role": "coordinate-semantics-registry",
        "artifact": {
          "uri": "schemas/sofaudit/coordinate-semantics-registry-v1.0.json",
          "digest": {
            "algorithm": "sha256",
            "value": "1d2dc24ae56cfb364b02bccf8c0c3068138e6d07682cf4b0561ec75f765c6d48"
          }
        }
      },
      {
        "role": "validator-implementation",
        "artifact": {
          "uri": "experiments/paper13/validation/validate_sofaudit_v2_1.py",
          "digest": {
            "algorithm": "sha256",
            "value": "a69cdcbb4fb7e29152ee1fd7200c8514d747290e5e118a9b81cb0fa8b4e98594"
          }
        }
      },
      {
        "role": "validation-receipt-contract",
        "artifact": {
          "uri": "schemas/sofaudit/validation-receipt-v2.1.schema.json",
          "digest": {
            "algorithm": "sha256",
            "value": "cdb8a32277a2e5d4f5eb30a9f72ce6450642e661d502ce141954dfed4e3b4ad6"
          }
        }
      }
    ],
    "closure_digest": {
      "algorithm": "sha256",
      "value": "f073aa8b97d58094854f77a838e37ec0952b3e4045ce3b6d48b31473ac4419bd"
    }
  },
  "status": "PASS",
  "checks": [
    {
      "check_id": "aligned-difference-without-attribution",
      "status": "PASS"
    },
    {
      "check_id": "artifact-digest-closure",
      "status": "PASS"
    },
    {
      "check_id": "explicit-v2.0-to-v2.1-migration",
      "status": "PASS"
    },
    {
      "check_id": "forbidden-semantic-role-scan",
      "status": "PASS"
    },
    {
      "check_id": "reference-role-boundary",
      "status": "PASS"
    },
    {
      "check_id": "schema-validation",
      "status": "PASS"
    },
    {
      "check_id": "source-report-receipt-validation",
      "status": "PASS"
    },
    {
      "check_id": "v2.0-source-validation",
      "status": "PASS"
    }
  ],
  "attribution_boundary": {
    "causal_status": "OUT_OF_SCOPE_FOR_SOFAUDIT",
    "defect_attribution_status": "OUT_OF_SCOPE_FOR_SOFAUDIT",
    "reference_causal_role": "NOT_A_CAUSAL_BASELINE"
  },
  "negative_boundaries": [
    "This receipt establishes aligned-comparison protocol conformance only; localization is not defect or causal attribution, and the reference is not a causal baseline."
  ]
}
